{"schema_version":"1.0","event_id":"33333333-3333-4333-8333-333333333333","media_id":"22222222-2222-4222-8222-222222222222","owner_sub":"user-123","sha256":"aaaaaaaaaaaaaaaaaaaaaaaaaaaaaaaaaaaaaaaaaaaaaaaaaaaaaaaaaaaaaaaa","media_type":"image","original_storage_uri":"s3://pacific-media/originals/aaaaaaaa/cassowary.jpg","thumbnail_storage_uri":"s3://pacific-media/derived/aaaaaaaa/thumbnail.jpg","frame_storage_uris":[],"occurred_at":"2026-08-22T04:00:00Z"}
